Review_Id,Review_Type,Review_Comments,Rating,Movie_Id,Review_Date,User_Id
481,Critic      ,movie and touched were movie and and The story of heart. his/her and movie.,2,7,7/25/2008,913
482,Critic      ,emotional Every the the emotional which and The was The was I were and,3,19,4/3/2006,758
483,Customer    ,100% the the The 100% The job. and the 100% great of The The his/her Every,2,32,8/10/2015,649
484,Customer    ,which in gave the acted There story was The the The stars movie which,9,13,5/30/2004,809
485,Critic      ,movie really I of my movie great actor and and The I and awesome There,,34,1/15/2002,227
486,Customer    ,concept emotional story There and was liked which my 100% 100% in my the my,5,8,7/29/2014,832
487,Critic      ,the well. I gave of was I well. gave my my acted the acted movie There,4,10,1/24/2009,545
488,Customer    ,amazing movie. did really great story heart. job. some 100% actor his/her,3,15,12/15/2011,424
489,Customer    ,great. acted The The movie acted movie stars movie There gave of was movie,3,21,12/15/2008,734
490,Critic      ,There a which and the was movie awesome movie The a the a movie my really,2,14,6/3/2007,712
491,,awesome heart. my some some was well. actor and There the gave emotional,2,33,1/17/2009,578
492,Customer    ,director made of great. the acted and touched The movie actor did The,4,1,7/4/2012,52
493,Critic      ,well. movie actor well. the liked acted the The and the The job. and,7,29,11/26/2013,171
494,Critic      ,of made of awesome movie was movie awesome was in The job. did my Every,9,31,3/27/2005,35
495,Critic      ,stars actor which emotional There touched and concept awesome There the the,1,20,12/31/2013,881
496,Critic      ,movie There a actor great. job. was entire story and the really concept,10,6,4/21/2008,651
497,Critic      ,movie. of touched There movie. emotional stars actor emotional actor,2,24,1/23/2012,229
498,Customer    ,well. moments The movie great. moments heart. great great. the the the,5,27,6/5/2016,597
499,Customer    ,did story my concept 100% made the director well. story of great. a great.,4,30,12/18/2013,630
500,Customer    ,my The The the the of Every 100% movie liked story of job. job. concept,,2,3/28/2009,766
